{
  "$schema": "./governance-manifest.schema.json",
  "network": "sepolia",
  "chainId": 11155111,
  "rpcEnv": "SEPOLIA_RPC_URL",
  "expectedGitCommit": "SET_VIA_EXPECTED_GIT_COMMIT_ENV",
  "illustrativeInputs": true,
  "expectedTokenCreationBytecodeHash": "0x6f048525545cc80f49c8c203f65d605beae18a4b0cc2d24bafaa9a57efebe872",
  "expectedVaultCreationBytecodeHash": "0x92af2dc53fc34d116fe0fa8062b920dcb5cd4b0fd2dc89f610f5e582c7d1e4e0",
  "minDeployerBalanceWei": "100000000000000000",
  "timelockMinDelay": 172800,
  "adminTransferDelay": 172800,
  "timelockProposerSafe": "0x0000000000000000000000000000000000001001",
  "timelockExecutorSafe": "0x0000000000000000000000000000000000001002",
  "emergencyPauserSafe": "0x0000000000000000000000000000000000001003",
  "genesisDistributionSafe": "0x0000000000000000000000000000000000001004",
  "treasurySafe": "0x0000000000000000000000000000000000001005",
  "liquiditySafe": "0x0000000000000000000000000000000000001006",
  "rewardsSafe": "0x0000000000000000000000000000000000001007",
  "strategicReserveSafe": "0x0000000000000000000000000000000000001008",
  "biniV1Token": "0x0000000000000000000000000000000000001012",
  "safeThresholds": {
    "0x0000000000000000000000000000000000001001": 2,
    "0x0000000000000000000000000000000000001002": 2,
    "0x0000000000000000000000000000000000001003": 2,
    "0x0000000000000000000000000000000000001004": 2,
    "0x0000000000000000000000000000000000001005": 2,
    "0x0000000000000000000000000000000000001006": 2,
    "0x0000000000000000000000000000000000001007": 2,
    "0x0000000000000000000000000000000000001008": 2
  },
  "dexPolicy": {
    "factories": [
      {"name": "Sepolia V2 factory placeholder", "kind": "UNISWAP_V2", "address": "0x0000000000000000000000000000000000006001", "runtimeCodeHash": "0x1111111111111111111111111111111111111111111111111111111111111111"},
      {"name": "Sepolia V3 factory placeholder", "kind": "UNISWAP_V3", "address": "0x0000000000000000000000000000000000006002", "runtimeCodeHash": "0x2222222222222222222222222222222222222222222222222222222222222222"}
    ],
    "infrastructure": [
      {"name": "Sepolia V4 PoolManager placeholder", "address": "0x0000000000000000000000000000000000006003", "runtimeCodeHash": "0x3333333333333333333333333333333333333333333333333333333333333333"}
    ]
  }
}
